{
  "$schema": "http://json-schema.org/draft-07/schema#",
  "$id": "suite.schema.json",
  "title": "AutoTestRunner suite",
  "description": "How to start and reset an app, and the suite's variables.",
  "type": "object",
  "required": [
    "name",
    "app"
  ],
  "properties": {
    "$schema": {
      "type": "string"
    },
    "name": {
      "type": "string",
      "description": "The suite's name."
    },
    "app": {
      "type": "object",
      "required": [
        "exe",
        "window"
      ],
      "properties": {
        "exe": {
          "type": "string",
          "description": "The program to start; ${variables} allowed."
        },
        "arguments": {
          "type": "string",
          "description": "What to start it with."
        },
        "window": {
          "type": "string",
          "description": "Its main window's title."
        },
        "startWindow": {
          "type": "string",
          "description": "The title of the window it opens first, when that isn't its main window, such as a sign-in window. A useWindow step moves on to the main window."
        },
        "runAsAdmin": {
          "type": "boolean",
          "description": "Restarts autotest as administrator, as the app needs it."
        },
        "status": {
          "type": "string",
          "description": "An element whose text says what the app is doing, such as a status bar. Its text before each click is kept for waitText's new."
        }
      },
      "additionalProperties": false
    },
    "variables": {
      "type": "object",
      "additionalProperties": {
        "anyOf": [
          {
            "type": [
              "string",
              "number",
              "boolean"
            ]
          },
          {
            "type": "object",
            "required": [
              "firstExisting"
            ],
            "properties": {
              "firstExisting": {
                "type": "array",
                "items": {
                  "type": "string"
                },
                "description": "The first path that exists, relative to the suite folder; the last when none does."
              }
            },
            "additionalProperties": false
          }
        ]
      }
    },
    "helpers": {
      "type": "object",
      "additionalProperties": {
        "type": "object",
        "required": [
          "regex"
        ],
        "properties": {
          "regex": {
            "type": "string",
            "description": "${name(value)} gives the regex's first group in value."
          }
        },
        "additionalProperties": false
      }
    },
    "requires": {
      "type": "array",
      "items": {
        "type": "string"
      },
      "description": "Paths that must exist before a run starts. If one doesn't, autotest exits with code 2."
    },
    "reset": {
      "type": "object",
      "properties": {
        "script": {
          "type": "string",
          "description": "A .ps1 or .cs file that removes what the suite leaves on the machine. A .cs runs with dotnet run, which needs the .NET 10 SDK."
        },
        "powershell": {
          "type": "string",
          "description": "The older name for script."
        },
        "leftovers": {
          "type": "string",
          "description": "A .ps1 or .cs file that prints one line for each thing an earlier run left; nothing on a clean machine."
        }
      },
      "additionalProperties": false
    },
    "databases": {
      "type": "object",
      "description": "Databases that query steps and dbValue checks use, by a name of your own.",
      "additionalProperties": {
        "type": "object",
        "required": [
          "kind",
          "connection"
        ],
        "properties": {
          "kind": {
            "enum": [
              "sqlServer",
              "postgres",
              "oracle",
              "mySql",
              "sqlite"
            ],
            "description": "sqlServer for SQL Server, Express and LocalDB; mySql for MySQL and MariaDB."
          },
          "connection": {
            "type": "string",
            "description": "Its connection string, as its .NET driver takes it; ${variables} allowed, so a password can come from --var."
          }
        },
        "additionalProperties": false
      }
    },
    "queues": {
      "type": "object",
      "description": "Message queues that send, receive and purge steps and queue checks use, by a name of your own.",
      "additionalProperties": {
        "type": "object",
        "required": [
          "kind",
          "queue"
        ],
        "properties": {
          "kind": {
            "enum": [
              "rabbitMq",
              "ibmMq",
              "msmq"
            ]
          },
          "queue": {
            "type": "string",
            "description": "The queue's name, or for MSMQ its path, such as .\\private$\\orders."
          },
          "connection": {
            "type": "string",
            "description": "The broker: amqp://user:password@host:5672/ for RabbitMQ, host(port) for IBM MQ."
          },
          "channel": {
            "type": "string",
            "description": "IBM MQ's server connection channel, such as DEV.APP.SVRCONN."
          },
          "queueManager": {
            "type": "string",
            "description": "IBM MQ's queue manager, such as QM1."
          },
          "user": {
            "type": "string",
            "description": "IBM MQ's user, when the channel asks for one."
          },
          "password": {
            "type": "string",
            "description": "IBM MQ's password; ${variables} allowed."
          },
          "format": {
            "enum": [
              "xml",
              "text"
            ],
            "description": "How an MSMQ message's text is written: xml, as .NET's XmlMessageFormatter does (the default), or plain text."
          }
        },
        "additionalProperties": false
      }
    },
    "software": {
      "type": "object",
      "description": "Software the suite needs on the computer, by a name of your own. The launcher looks for it when the suite is picked and offers to install what is missing; autotest setup does the same from the command line. Each has one of winget, windowsFeature or script.",
      "additionalProperties": {
        "type": "object",
        "properties": {
          "title": {
            "type": "string",
            "description": "What a person calls it, such as SQL Server Express."
          },
          "winget": {
            "type": "string",
            "description": "The winget package id, such as Microsoft.SQLServer.2022.Express."
          },
          "version": {
            "type": [
              "string",
              "number"
            ],
            "description": "The version wanted: one that starts with it will do, such as 3.13 for 3.13.7. Left out, any version, and the latest is installed."
          },
          "windowsFeature": {
            "type": "string",
            "description": "A Windows feature, as Enable-WindowsOptionalFeature names it, such as MSMQ-Server. Installing it needs administrator."
          },
          "script": {
            "type": "string",
            "description": "A .ps1 or .cs file that installs it, relative to the suite folder."
          },
          "args": {
            "type": "array",
            "items": {
              "type": "string"
            },
            "description": "What the script is given; ${version} is the version."
          },
          "present": {
            "$ref": "case.schema.json#/definitions/check",
            "description": "A check that passes when it is installed, such as { \"service\": \"RabbitMQ\", \"state\": \"Running\" }. A script needs one."
          },
          "administrator": {
            "type": "boolean",
            "description": "The script needs administrator, which is asked for before it runs."
          }
        },
        "additionalProperties": false
      }
    },
    "screen": {
      "type": "object",
      "properties": {
        "width": {
          "type": "integer"
        },
        "height": {
          "type": "integer"
        }
      },
      "description": "The smallest screen the suite is written for."
    },
    "builder": {
      "type": "object",
      "description": "What the builder does while recording a case.",
      "properties": {
        "watch": {
          "type": "array",
          "description": "Controls whose text the builder watches: when it changes after a step, it adds a wait for the new text. The app's status, and any element with a macro named waitFor and its name, are watched anyway.",
          "items": {
            "type": "object",
            "required": [
              "element"
            ],
            "properties": {
              "element": {
                "type": "string",
                "description": "The control, by its name in elements.json."
              },
              "call": {
                "type": "string",
                "description": "The macro that waits for it, given startsWith when it takes it. A waitText when left out."
              },
              "check": {
                "type": "boolean",
                "description": "Also keeps what it said, and checks it at the checkpoint."
              }
            },
            "additionalProperties": false
          }
        },
        "afterClick": {
          "type": "array",
          "description": "Steps the builder adds after a control is clicked, instead of a wait for the status text.",
          "items": {
            "type": "object",
            "required": [
              "element",
              "call"
            ],
            "properties": {
              "element": {
                "type": "string",
                "description": "The control clicked, by its name in elements.json."
              },
              "call": {
                "type": "string",
                "description": "The macro to run after it."
              },
              "with": {
                "type": "object",
                "additionalProperties": {
                  "type": [
                    "string",
                    "number",
                    "boolean"
                  ]
                },
                "description": "The macro's parameters."
              },
              "delay": {
                "type": [
                  "number",
                  "string"
                ],
                "description": "Seconds to wait before the macro, as a wait step."
              }
            },
            "additionalProperties": false
          }
        }
      },
      "additionalProperties": false
    }
  },
  "additionalProperties": false
}
