{
  "$schema": "../../schema/suite.schema.json",
  "name": "Order Desk feature tour",
  "app": { "exe": "${exe}", "window": "Order Desk", "status": "statusText" },
  "variables": {
    "exe": { "firstExisting": [
      "../OrderDesk/OrderDesk.exe",
      "../OrderDesk/bin/Release/net10.0-windows/OrderDesk.exe",
      "../OrderDesk/bin/Debug/net10.0-windows/OrderDesk.exe"
    ] },
    "dataDir": "${env:LOCALAPPDATA}\\OrderDesk",
    "ordersFile": "${dataDir}\\orders.json",
    "activityLog": "${dataDir}\\activity.log"
  },
  "helpers": {
    "amount": { "regex": "£(\\d+\\.\\d\\d)" },
    "exportedFile": { "regex": "File: (.+)$" }
  },
  "requires": ["${exe}"],
  "reset": { "script": "tools/Reset-OrderDesk.ps1", "leftovers": "tools/Find-Leftovers.ps1" }
}
